{
  "schemaVersion": 1,
  "kind": "NormalizedResult",
  "contractsVersion": "0.3.0",
  "runId": "perf-20260902-120000-a1b2c3d4",
  "testId": "checkout-api",
  "workload": {
    "id": "checkout-smoke",
    "version": "1.0.0",
    "sha256": "24641469a2ab819c520ad389e112ea62f96b8a54604401d147a529e6d8da5a05"
  },
  "producer": {
    "name": "perfeng-analysis",
    "version": "0.1.0",
    "image": "ghcr.io/example/perfeng-analysis@sha256:ffffffffffffffffffffffffffffffffffffffffffffffffffffffffffffffff"
  },
  "measurementWindow": {
    "start": "2026-09-02T12:00:00Z",
    "end": "2026-09-02T12:02:00Z"
  },
  "createdAt": "2026-09-02T12:02:03Z",
  "sourceArtifacts": [
    {
      "id": "11111111-1111-4111-8111-111111111111",
      "runId": "perf-20260902-120000-a1b2c3d4",
      "kind": "raw",
      "uri": "s3://perfeng-example/runs/perf-20260902-120000-a1b2c3d4/raw/k6-summary.json",
      "sha256": "765e697a5a9036636e44dcd1caed0dd176f58b7e621f2c747e99e779f8400fe1",
      "sizeBytes": 172,
      "mediaType": "application/json",
      "format": "k6-summary-json"
    }
  ],
  "results": [
    {
      "schemaVersion": 2,
      "runId": "perf-20260902-120000-a1b2c3d4",
      "metric": {
        "name": "api.http.duration",
        "direction": "lower-is-better",
        "type": "latency",
        "unit": "ms"
      },
      "distribution": {
        "mean": 180,
        "p95": 260
      }
    }
  ]
}
